{
  "$schema": "./comparison-workload.schema.json",
  "schema_version": "bp-comparison-workload-v1",
  "manifest_id": "bp-perf-v3-decision-3",
  "decision_contract_version": "bp-perf-v3-decision-3",
  "seed": 20260823,
  "coordinate_space": "pdf-points-bottom-left",
  "environment": {
    "window_css_pixels": { "width": 1200, "height": 800 },
    "display_scale_factor": 1,
    "theme": "light",
    "cache_classes": ["app-cold", "declared-warm"],
    "input_lanes": ["native-replay", "semantic-diagnostic"]
  },
  "fixtures": [
    { "id": "bp-single-page-v1", "role": "small-open-and-shell-control" },
    { "id": "bp-multi-page-v1", "role": "navigation-and-cache-control" },
    { "id": "bp-annotation-density-v1", "role": "sparse-and-100-visible-annotation-pages" },
    { "id": "bp-annotation-all-v1", "role": "representative-native-and-unknown-annotations" },
    { "id": "nasa-apollo-summary-526-v1", "role": "long-document-scroll-and-navigation" },
    { "id": "usgs-usa-geology-sheet-v1", "role": "large-sheet-pan-zoom-and-tiling" }
  ],
  "assets": [
    {
      "id": "bp-image-checker-v1",
      "kind": "generated-rgba-png",
      "width_pixels": 512,
      "height_pixels": 384,
      "sha256": "fcc714d1ac60ed4b88abf7297830479c7557cb9d219033e7a5a5ad4d6ec18dda"
    }
  ],
  "journeys": [
    {
      "id": "viewer-v1",
      "fixtures": ["bp-single-page-v1", "bp-multi-page-v1", "nasa-apollo-summary-526-v1", "usgs-usa-geology-sheet-v1"],
      "commands": [
        {
          "id": "viewer:launch-cold",
          "operation": "app.launch-cold",
          "cache_class": "app-cold",
          "expected_milestones": ["process-started", "native-window-presented", "interactive-shell"]
        },
        {
          "id": "viewer:open-each",
          "operation": "document.open",
          "fixture_sequence": ["bp-single-page-v1", "bp-multi-page-v1", "nasa-apollo-summary-526-v1", "usgs-usa-geology-sheet-v1"],
          "expected_milestones": ["document-opened", "preview-current-generation", "settled-current-generation-250ms"]
        },
        {
          "id": "viewer:layout-single",
          "operation": "viewer.set-layout",
          "layout": "single-page",
          "expected_milestones": ["per-page-geometry-matched", "annotation-thumbnail-current"]
        },
        {
          "id": "viewer:layout-continuous",
          "operation": "viewer.set-layout",
          "layout": "continuous",
          "expected_milestones": ["per-page-geometry-matched", "virtual-page-window-bounded"]
        },
        {
          "id": "viewer:navigate-normalized",
          "operation": "viewer.navigate-normalized-sequence",
          "page_formula": ["last", "ceil(0.08*n)", "ceil(0.72*n)", "ceil(0.25*n)", "ceil(0.90*n)", "ceil(0.50*n)", "11", "ceil(0.958*n)", "ceil(0.33*n)", "1"],
          "clamp": "1..page-count",
          "deduplicate_after_clamp": true,
          "expected_milestones": ["target-page-current", "preview-current-generation", "settled-current-generation-250ms"]
        },
        {
          "id": "viewer:zoom-sequence",
          "operation": "viewer.zoom-sequence",
          "fixture_id": "usgs-usa-geology-sheet-v1",
          "percent": [100, 200, 400, 800, 1600, 400, 100, 800, 200, 100, 1200, 100],
          "expected_milestones": ["zoom-state-current", "visible-tiles-bounded", "preview-current-generation", "settled-density-at-least-1"]
        },
        {
          "id": "viewer:pan-usgs",
          "operation": "viewer.pan-path",
          "fixture_id": "usgs-usa-geology-sheet-v1",
          "zoom_percent": 1600,
          "duration_ms": 5000,
          "rate_hz": 120,
          "normalized_viewport_points": [[0.50, 0.50], [0.75, 0.50], [0.75, 0.75], [0.25, 0.75], [0.25, 0.25], [0.50, 0.50]],
          "expected_milestones": ["visible-tiles-bounded", "stale-generations-presented-zero", "settled-density-at-least-1"]
        },
        {
          "id": "viewer:continuous-scroll",
          "operation": "viewer.continuous-scroll-path",
          "fixture_id": "nasa-apollo-summary-526-v1",
          "input_rate_hz": 120,
          "path": {
            "forward_duration_ms": 20000,
            "forward_viewport_heights": 50,
            "pause_duration_ms": 2000,
            "reverse_duration_ms": 10000,
            "finish_page": 1
          },
          "expected_milestones": ["timestamped-input-complete", "virtual-page-window-bounded", "finish-page-current", "blank-current-generation-frames-zero"]
        },
        {
          "id": "viewer:cache-pressure",
          "operation": "viewer.cache-pressure-cycles",
          "cycles": 5,
          "sequence": ["navigate", "zoom", "pan", "return-page-1"],
          "expected_milestones": ["declared-cache-byte-limit-held", "decoded-byte-limit-held", "upload-byte-count-recorded"]
        },
        {
          "id": "viewer:close-recover-reopen",
          "operation": "document.close-recover-reopen",
          "reopen_cache_class": "declared-warm",
          "expected_milestones": ["document-resources-released", "memory-recovery-recorded", "document-reopened", "settled-current-generation-250ms"]
        }
      ]
    },
    {
      "id": "rectangle-v1",
      "fixtures": ["bp-annotation-density-v1"],
      "commands": [
        {
          "id": "rectangle:create-sparse",
          "operation": "annotation.rectangle.create",
          "page_role": "empty-interaction-page",
          "annotation_id": "comparison:rectangle:sparse:1",
          "pointer_path": {
            "rate_hz": 120,
            "duration_ms": 3000,
            "expected_sample_count": 361,
            "coordinate_space": "pdf-points-bottom-left",
            "start": { "x": 72, "y": 144 },
            "finish": { "x": 252, "y": 240 },
            "interpolation": "linear-inclusive"
          },
          "style": { "stroke": "#ff0000ff", "fill": null, "width_pt": 1, "dash": "solid", "opacity": 1 },
          "expected_milestones": ["pointer-stream-received", "gesture-committed-once", "annotation-painted", "thumbnail-current"]
        },
        {
          "id": "rectangle:select-move-resize",
          "operation": "annotation.rectangle.transform",
          "annotation_id": "comparison:rectangle:sparse:1",
          "select_point": { "x": 117, "y": 240 },
          "move": { "rate_hz": 120, "duration_ms": 3000, "delta": { "x": 18, "y": -12 } },
          "resize": { "rate_hz": 120, "duration_ms": 3000, "handle": "east", "delta": { "x": 30, "y": 0 } },
          "expected_milestones": ["hit-test-selected", "move-committed-once", "resize-committed-once"]
        },
        {
          "id": "rectangle:properties-history",
          "operation": "annotation.rectangle.properties-history",
          "annotation_id": "comparison:rectangle:sparse:1",
          "properties": { "stroke": "#dc2626ff", "fill": "#dc26261f", "width_pt": 3, "dash": "dashed", "opacity": 0.88 },
          "sequence": ["set-properties", "lock", "verify-transform-rejected", "unlock", "undo-each-commit", "redo-each-commit"],
          "expected_milestones": ["properties-current", "locked-edit-rejected", "undo-redo-exact", "dirty-current"]
        },
        {
          "id": "rectangle:repeat-dense",
          "operation": "annotation.rectangle.repeat-on-dense-page",
          "page_role": "100-visible-annotations-page",
          "source_commands": ["rectangle:create-sparse", "rectangle:select-move-resize", "rectangle:properties-history"],
          "expected_milestones": ["spatial-index-work-recorded", "annotation-paint-work-recorded", "canonical-state-matched"]
        }
      ]
    },
    {
      "id": "highlight-v1",
      "fixtures": ["bp-annotation-density-v1"],
      "commands": [
        {
          "id": "highlight:create",
          "operation": "annotation.highlight.create",
          "annotation_id": "comparison:highlight:1",
          "pointer_path": {
            "rate_hz": 120,
            "duration_ms": 3000,
            "expected_sample_count": 361,
            "coordinate_space": "pdf-points-bottom-left",
            "control_points": [[90, 330], [150, 337], [220, 329], [300, 334]],
            "interpolation": "catmull-rom-inclusive"
          },
          "style": { "color": "#ffff00ff", "width_pt": 12, "opacity": 1, "blend": "multiply" },
          "expected_milestones": ["pointer-stream-received", "path-smoothed", "gesture-committed-once", "annotation-painted"]
        },
        {
          "id": "highlight:edit-history",
          "operation": "annotation.highlight.edit-history",
          "annotation_id": "comparison:highlight:1",
          "move_delta": { "x": 12, "y": -6 },
          "sequence": ["select-by-hit-test", "move", "set-opacity-0.45", "undo", "redo"],
          "expected_milestones": ["hit-test-selected", "path-bounds-current", "undo-redo-exact", "thumbnail-current"]
        }
      ]
    },
    {
      "id": "text-v1",
      "fixtures": ["bp-annotation-density-v1"],
      "commands": [
        {
          "id": "text:create",
          "operation": "annotation.text.create",
          "annotation_id": "comparison:text:1",
          "placement": {
            "point": { "x": 210, "y": 426 },
            "sizing": "shaped-text-autosize-nonblank"
          },
          "text": "Beam B-12 / revision 3",
          "font": { "family": "Helvetica", "size_pt": 14, "weight": 400, "color": "#111827ff", "alignment": "left" },
          "expected_milestones": ["text-input-committed", "text-shaped", "annotation-painted", "gesture-committed-once"]
        },
        {
          "id": "text:edit-resize-history",
          "operation": "annotation.text.edit-resize-history",
          "annotation_id": "comparison:text:1",
          "replacement_text": "Beam B-12 / revision 4",
          "resize_bounds": { "x": 90, "y": 390, "width": 300, "height": 84 },
          "sequence": ["select", "replace-text", "resize", "undo-resize", "redo-resize"],